"text","cmp_code","eu_code"
"die Spielräume für Überstunden müssen deutlich zugunsten neuer Arbeitsplätze eingeschränkt werden","701",NA
"Dabei werden wir bei der Reform des Arbeitszeitgesetzes den zahlreichen tarifvertraglich und betrieblich entstandenen flexiblen Arbeitszeitmodellen Rechnung tragen, soweit sie an den Interessen der Betroffenen anknüpfen","701",NA
"und dem Ziel einer gerechteren Verteilung der Arbeit dienen","503",NA
"So kann ein vielfältiges Angebot von Wahlarbeitszeiten und Modellen wie Jobsharing, Freistellungen oder individuelle Arbeitszeitverkürzung zur Weiterbildung, Kindererziehung und Pflege sowie neue Modelle der ”Alters- und Berufsanfängerteilzeit” entstehen","503",NA
"Zentrale Prinzipien der notwendigen rechtlichen Verankerung sind die grundsätzliche Freiwilligkeit von individueller Arbeitszeitverkürzung mit Rückkehrrecht und die Rechtsgleichheit von Voll- und Teilzeitbeschäftigten","701",NA
"Mit Blick auf die veränderten Bedingungen flexibilisierter Arbeitszeiten müssen die kollektiven Schutz- und Dispositionsrechte ausgebaut werden","701",NA
"Dabei geht es vor allem um den Zugriff auf Jahresarbeitszeitkonten und den Zugang zu Zeiterfassungssystemen","701",NA
"sowie den Bestandsschutz von Arbeitszeitguthaben bei Insolvenzen und Betriebswechseln","701",NA
"Die Einführung von Übergangsarbeitsmärkten sowie rechtlich und sozial abgesicherten Rotationsregeln kann Wege aus dauerhafter Erwerbslosigkeit und neue Beschäftigungspotentiale eröffnen","504",NA
"Sie sollen Brücken bilden zwischen den verschiedenen Formen von Beschäftigung und z|B| die Beschäftigung von Arbeitslosen während der Weiterbildung von ArbeitnehmerInnen ermöglichen","701",NA
"Anreize für die ArbeitgeberInnen, etwa durch Einarbeitungszuschüsse, wären für die Bundesanstalt praktisch kostenneutral, da sie auf der Umwidmung von passiven auf aktive Mittel beruhen","303",NA
"Angesichts großer Einkommensunterschiede kann für die unteren und mittleren Lohngruppen die wirksame Durchsetzung der Arbeitszeitverkürzung nur durch einen finanziellen Ausgleich erreicht werden","503",NA
"Vor diesem Hintergrund begrüßen wir die Initiativen der Gewerkschaften zu einem differenzierten Lohnausgleich für die unteren und mittleren Einkommensgruppen","701",NA
"Über tarifliche Anstrengungen hinaus müssen öffentliche Kompensationsangebote eingeführt werden","504",NA
"Dazu gehören die nach der grünen Einkommensteuerreform vorgesehene Anhebung des steuerlichen Existenzminimums und des Kindergeldes","504",NA
"Aus den Mitteln der Bundesanstalt für Arbeit sind differenzierte Modelle befristeter Teilzeitbeihilfen und des Teilarbeitslosengeldes zu finanzieren","504",NA
"BÜNDNIS 90/DIE GRÜNEN setzen sich außerdem für eine individuelle Aufstockung von Rentenanwartschaften ein","504",NA
"Durch finanzielle Anreize wollen BÜNDNIS 90/DIE GRÜNEN die Unternehmen bewegen, Arbeitszeit zu verkürzen","701",NA
"Das grüne Bonus-Malus-Modell schafft durch die arbeitszeitbezogene Differenzierung der Sozialversicherungsbeiträge der ArbeitgeberInnen Anreize zur Arbeitszeitverkürzung","701",NA
"Das Aufkommen der ArbeitgeberInnenbeiträge wollen wir so umverteilen, daß Betriebe, die die Gesamtmenge der Arbeitszeit auf viele Beschäftigte verteilen, entlastet werden","701",NA
"Betriebe, die wenige Teilzeitarbeitsplätze anbieten, sollen dagegen belastet werden","701",NA
"Reform und Ausbau der Arbeitsförderungspolitik",NA,NA
"Um die Massenarbeitslosigkeit wirksam zu bekämpfen, ist aktive Arbeitsförderung unverzichtbar","701",NA
"BÜNDNIS 90/DIE GRÜNEN setzen den Schwerpunkt auf präventive und aktive Arbeitsmarktpolitik – statt lediglich Arbeitslosigkeit zu finanzieren","303",NA
"Durch die Umschichtung von passiven zu aktiven Leistungen wollen wir Beschäftigungssicherung und Beschäftigungssteigerung in den Vordergrund stellen","701",NA
"Mindestens die Hälfte der Mittel der Bundesanstalt für Arbeit muß für aktive Förderpolitik zur Verfügung stehen","504",NA
"Diese Mittel müssen mit den Arbeitsförderungs-Maßnahmen der Länder, Kommunen, ArbeitgeberInnen und Träger abgestimmt eingesetzt werden","303",NA
"sowie Anreize zur Mobilisierung zusätzlicher Mittel geschaffen werden","303",NA
"Arbeitsförderung darf die tariflichen Regelungen des ersten Arbeitsmarktes nicht unterlaufen","401",NA
"Untertarifliche Bezahlung darf keine Förderungsbedingung sein","701",NA
"und eine Vertragsgestaltung, die branchenübliche tarifliche Standards verletzt oder unterläuft, darf nicht durch Mittel der Arbeitsförderung honoriert werden","701",NA
"Insgesamt müssen die Instrumente der Arbeitsförderpolitik zielgenauer eingesetzt werden","303",NA
"Gruppen, die besondere Probleme am Arbeitsmarkt haben – Langzeitarbeitslose, Menschen mit Behinderungen, Niedrigqualifizierte, Jugendliche ohne Schulabschluß und AusländerInnen – müssen integriert und besonders unterstützt werden","701",NA
"Ein Modell dafür sind die sogenannten ”sozialen” Betriebe","701",NA
"Mit ihrer Zielvorgabe, gesellschaftlich sinnvolle und gleichzeitig wirtschaftlich ertragreiche Arbeitsplätze zu schaffen, beschränken sie sich nicht auf ”zusätzliche” und gemeinnützige Tätigkeiten","701",NA
"Sie bieten vielmehr marktfähige Güter und Dienste an, um einen möglichst hohen Teil ihrer Kosten selbst zu erwirtschaften","701",NA
"Durch eine Erhöhung der Ausgleichsabgabe für nicht-besetzte Pflicht-Arbeitsplätze für Schwerbehinderte soll der Anreiz zur Einstellung schwerbehinderter ArbeitnehmerInnen gesteigert werden","705",NA
"Nach 15 Jahren stetig anwachsender Erwerbslosenzahlen ist offensichtlich, daß viele Menschen, insbesondere Langzeitarbeitslose, über die Marktkräfte allein in absehbarer Zukunft keinen Arbeitsplatz finden werden","504",NA
"Deshalb treten wir für die langfristige Etablierung eines zusätzlichen öffentlich geförderten Beschäftigungssektors ein","504",NA
"Damit können auch neue Aufgaben zwischen Markt und öffentlicher Hand entwickelt werden","504",NA
"Gleichzeitig wollen BÜNDNIS 90/DIE GRÜNEN die starren Grenzen zwischen ”erstem” und ”zweitem” Arbeitsmarkt auflösen","701",NA
"Aufgabe der aktiven Arbeitsmarktpolitik ist es, Brücken zu regulären Beschäftigungsverhältnissen zu bauen","701",NA
"Besondere Bedeutung hat Weiterbildung und Fortbildung","411",NA
"Transparenz und eine zielgenaue Orientierung am wirtschaftlichen Bedarf bilden hierfür die Grundlage","303",NA
"Dabei sind die klassischen Bildungseinrichtungen verstärkt einzubinden","506",NA
"Mehr Beschäftigungsmöglichkeiten für junge Frauen",NA,NA
"und Männer – Jugenderwerbslosigkeit aktiv bekämpfen",NA,NA
"Bei allen arbeitsmarktpolitischen Maßnahmen muß die besondere Situation von Jugendlichen berücksichtigt werden","706",NA
"Um das Recht von Jugendlichen auf einen Ausbildungsplatz sicherzustellen, fordern wir eine Umlagefinanzierung","706",NA
"Arbeitsmarktpolitik, die junge Menschen im Blick hat, muß auch die Stärkung von Selbstbestimmungsrechten junger Beschäftigter und Auszubildender berücksichtigen","706",NA
"Für erwerbslose Jugendliche muß ein Recht auf Integration in den Arbeitsmarkt","706",NA
"und Qualifizierungsmaßnahmen nach spätestens sechs Monaten bestehen","411",NA
"Langfristig muß sichergestellt sein, daß Auszubildende im erlernten Beruf für mindestens ein Jahr beschäftigt werden","701",NA
"Jede dauerhafte Beschäftigung sozialversichern",NA,NA
"Immer mehr Menschen sind gezwungen, als Scheinselbständige oder geringfügig Beschäftigte ohne Sozialversicherungsschutz zu arbeiten, zum Teil ohne Aussicht auf existenzsichernde Einkommen","701",NA
"Diese prekären Erwerbs- und Beschäftigungsmuster müssen arbeits- und sozialversicherungsrechtlich abgesichert,","504",NA
"finanzielle und steuerliche Diskriminierungen müssen abgebaut werden","701",NA
"Jede dauerhafte Beschäftigung muß sozialversichert sein","504",NA
"Arbeitsmarkt- und Strukturpolitik verzahnen",NA,NA
"Vor allem mit Blick auf die Beschäftigungssituation in Ostdeutschland und anderen strukturschwachen Regionen müssen neue Wege in der Arbeitspolitik eingeschlagen werden","701",NA
"BÜNDNIS 90/DIE GRÜNEN haben ein Konzept vorgelegt: Ein Teil der Lohnkostenzuschüsse der Bundesanstalt für Arbeit soll in die regionale Strukturpolitik eingebunden und an die Durchführung von Investitionen geknüpft werden","303",NA
"Für die geförderten Unternehmen besteht eine Nachbeschäftigungspflicht","701",NA
"Frauen sind gleichberechtigt zu fördern","503",NA
"BÜNDNIS 90/DIE GRÜNEN wollen auch Existenzgründungen aus der Erwerbslosigkeit heraus unterstützen sowie die Verknüpfung von Arbeitsmarktpolitik mit einem Non-Profit-Sektor fördern","701",NA
"Existenzgründung aus der Erwerbslosigkeit heraus darf nicht zu einer neuen Art ungeschützter Beschäftigungsverhältnisse führen","701",NA
"Generell sind arbeitsmarktpolitische Instrumente stärker auf regionale Entwicklungskonzepte hin auszurichten, um die regionalen Potentiale zu stärken","303",NA
"Ziel ist die Bündelung der verschiedenen Aktivitäten und Finanzmittel zu einer regionalen Förderung aus einer Hand","303",NA
"Für eine europäische Beschäftigungspolitik",NA,NA
"Die Internationalisierung der Märkte relativiert die Reichweite nationaler Beschäftigungspolitik","408",NA
"BÜNDNIS 90/DIE GRÜNEN setzen deshalb auf eine stärkere Koordination der nationalen Beschäftigungspolitiken","303","108"
"Um die Erwerbslosigkeit in Europa effektiv zu bekämpfen, fordern wir vom Europäischen Rat einen ”Europäischen Pakt für Beschäftigung, Solidarität und Ökologie” mit bindenden Verpflichtungen für die Mitgliedstaaten","701","108"
"Dabei setzen wir vorrangig auf gemeinsame Schritte zur Harmonisierung der Arbeitszeitverkürzung","701","108"
"BÜNDNIS 90/DIE GRÜNEN setzen sich für einen europäischen Investitionsfonds ein, der arbeitsplatzschaffende Infrastrukturprojekte finanzieren und neue Jobs schaffen soll","701","108"
"Dabei sollten besonders dezentrale Netzwerke gefördert werden: der Ausbau der Schiene im Regionalverkehr, erneuerbare Energien, nichtkommerzielle und öffentlich-rechtliche Angebote in Multimedia- und Informationsnetzwerken, Umweltschutz, Stadterneuerung und der Ausbau von Dienstleistungsangeboten im Sozial- und Kulturbereich","416","108"
"Bestehende Fonds müssen umstrukturiert und auf diese Kriterien hin effektiviert werden","303","108"
"Durch die EU-Förderpolitik sollen Nachhaltigkeit,","416","108"
"Beschäftigung und","701","108"
"Gleichstellung von Frauen gefördert werden","503","108"
"Die Schaffung neuer Arbeitsplätze muß bei der Vergabe von EU-Strukturfördermitteln Vorrang haben","701",NA
"Ein ”Öko-Audit”, das die Nachhaltigkeit garantiert, ist unverzichtbar","416",NA
"Mindestens ein Drittel der Ressourcen für Strukturförderung sollen für lokale Entwicklung und lokale Beschäftigung gebunden werden","408",NA
"Arbeitsmarktpolitik finanzieren",NA,NA
"ist gesamtgesellschaftliche Aufgabe",NA,NA
"Die volkswirtschaftlichen Kosten der Arbeitslosigkeit betrugen 1997 etwa 180 Mrd| DM","408",NA
"Die Finanzierung der Arbeitsmarktpolitik kann nicht einseitig auf die BeitragszahlerInnen der Sozialversicherungen abgewälzt werden","503",NA
"Daher muß neben der Einbeziehung aller in die Sozialsysteme ein beträchtlicher Teil aus Steuermitteln finanziert werden","503",NA
"Im grünen Ökosteuer-Konzept sind Mittel für die Senkung der Arbeitslosenversicherung vorgesehen","504",NA
"Mit der Ausweitung der Steuerfinanzierung von Arbeitsmarktpolitik wird der Versicherungscharakter der Arbeitslosenversicherung nicht in Frage gestellt","503",NA
"BÜNDNIS 90/DIE GRÜNEN halten an den Prinzipien der Beitragsfinanzierung, der geteilten Beitragserhebung und der solidarischen Umverteilung innerhalb der Arbeitslosenversicherung fest","503",NA
"Zur Finanzierung aktiver Arbeitsmarktpolitik ist ein zweckgebundener Bundeszuschuß in die Arbeitslosenversicherung einzuführen, der den Schwerpunkt auf aktive Maßnahmen legt","701",NA
"Fairen Wettbewerb gestalten –",NA,NA
"Wirtschaftsmacht begrenzen",NA,NA
"Das Produktivvermögen ist in der Bundesrepublik Deutschland einseitig verteilt","503",NA
"Eine kleine Minderheit bestimmt über das Wie und Was der Produktion","503",NA
"Diese Konzentration wirtschaftlicher Macht führt zur Verzerrung vieler Marktprozesse und beeinträchtigt die demokratische Gleichheit der politischen Teilnahme aller","503",NA
"BÜNDNIS 90/DIE GRÜNEN wollen das Gesetz gegen Wettbewerbsbeschränkungen reformieren","403",NA
"und die Fusionskontrolle verschärfen","403",NA
"Monopolstrukturen müssen aufgelöst,","403",NA
"Wirtschaftsmacht eingeschränkt","403",NA
"und kleine und mittlere Unternehmen geschützt werden","403",NA
"Fairer Wettbewerb nützt auch VerbraucherInnen, die sonst überhöhte Preise bei einem geringeren Angebot zahlen müssen","403",NA
"Auch ihre Nahversorgung würde empfindlich gestört","403",NA
"BÜNDNIS 90/DIE GRÜNEN wollen eine neue Wettbewerbsordnung, insbesondere für neue Medien, Energiewirtschaft, Banken sowie Handel und Tourismus, verankern","403",NA
"BÜNDNIS 90/DIE GRÜNEN wollen den Marktzutritt für die AnbieterInnen umweltfreundlicher Energie erleichtern","403",NA
"Eine Reform des Energiewirtschaftsrechts muß die marktbeherrschende Stellung der Stromkonzerne auflösen","403",NA
"Alle EnergieanbieterInnen müssen die Chance haben, das Netz zu nutzen","403",NA
"Deshalb setzen wir uns ein für die eigentumsrechtliche Trennung von Energieerzeugung, Energietransport und -verteilung","403",NA
"Zusätzlich ist ein Stromeinspeisegesetz notwendig, das die Marktchancen der AnbieterInnen von Windkraft und Solarstrom verbessert","403",NA
"BÜNDNIS 90/DIE GRÜNEN wollen das Aktienrecht reformieren, das wirtschaftliche Macht einseitig bei den Banken konzentriert, und das die enge Verflechtung von Banken und Großindustrie fördert","403",NA
"Die Kontrollfunktion der Aufsichtsräte und des Kapitalmarkts müssen gestärkt werden","403",NA
"Großbanken und wenige Versicherungskonzerne haben großen Einfluß auf viele Unternehmen gewonnen","403",NA
"Deshalb fordern BÜNDNIS 90/DIE GRÜNEN: eine Begrenzung und Offenlegung der Beteiligungen,","403",NA
"? eine Begrenzung der Zahl der Aufsichtsratsmandate,","403",NA
"? die Abschaffung des weisungslosen Depotstimmrechts","403",NA
"Parallel muß der Wettbewerb in der Finanzwirtschaft gestärkt werden","403",NA
"Besonders wichtig ist der Aufbau eines funktionsfähigen privaten Risikokapitalmarktes, um die Finanzierungsbedingungen insbesondere für kleine und mittlere Unternehmen als TrägerInnen von Innovationen und Arbeitsplätzen zu verbessern","403",NA
"Von den Banken fordern wir, daß sie sich von ihrer starren Sicherheitsorientierung lösen und menschlichen Fähigkeiten und Fertigkeiten durch die Bereitschaft zur Vergabe von Risikokapital mehr Kredit einräumen","408",NA
"Hierbei werden vor allem die kleinen und mittelständischen Banken durch eine Flut an Bürokratie und Überregulierung gehindert","402",NA
"Wir wollen deshalb das Gesetz über das Kreditwesen und die Praxis der Bankenaufsicht reformieren","402",NA
"BÜNDNIS 90/DIE GRÜNEN wollen eine Beteiligung von ArbeitnehmerInnen am Produktivvermögen","701",NA
"Hierzu werden wir in der nächsten Legislaturperiode ein Konzept erarbeiten, das die verschiedenen positiven Aspekte aufbereitet","701",NA
"Mehr Demokratie in der Wirtschaft",NA,NA
"BÜNDNIS 90/DIE GRÜNEN wollen die Mitentscheidungsmöglichkeiten abhängig Beschäftigter stärken","202",NA
"und den ArbeitnehmerInnen in den Betrieben mehr Schutz vor unternehmerischen Fehlentscheidungen verschaffen","701",NA
"Mehr Schutz ergibt sich aus mehr Mitbestimmung","701",NA
"Mehr Mitbestimmung bedeutet bei kleineren Betrieben aber auch die Übernahme von mehr Mitverantwortung für die Entwicklung des Betriebes","701",NA
"Mit einer Reform des Betriebsverfassungsgesetzes soll den Beschäftigten und ihren betrieblichen Interessenvertretungen ein erweitertes Informations- und Beteiligungsrecht eingeräumt werden","202",NA
"BÜNDNIS 90/DIE GRÜNEN wollen die betriebliche Mitbestimmung in kleinen und mittleren Betrieben klarer regeln","701",NA
"Dabei wollen wir die Gestaltungsspielräume für ArbeitnehmerInnen und Unternehmen zur Wahrnehmung und zum Ausgleich der Interessen bei kleineren Betrieben erweitern","401",NA
"Über die Förderung entsprechender Beratungsangebote soll den Betrieben und den MitarbeiterInnen bei der Suche nach Konfliktlösungspotentialen bei innerbetrieblichen Konflikten verstärkt geholfen werden","408",NA
"Über eine Neufassung des Unternehmensbegriffs sollen Kleinstunternehmer und Freiberufler zu ihrer sozialen Absicherung ArbeitnehmerInnenrechte erhalten","704",NA
"Die Rolle der Betriebsräte großer bzw internationaler Betriebe ist im Hinblick auf die Einführung echter Mitbestimmungsrechte neu zu definieren","702",NA
"ArbeitnehmerInneninteressen müssen in Kapitalgesellschaften die gleiche Bedeutung wie die Interessen der Aktionäre erhalten, damit die Sicherung von Arbeitsplätzen Bestandteil der Unternehmenspolitik wird","701",NA
"Verstärkt gehen Unternehmen jedoch dazu über, geltendes Recht zu brechen, indem sie sich nicht an tarifvertragliche Vorschriften halten und Betriebsräte unter Druck setzen, tarifwidrige Betriebsvereinbarungen abzuschließen","701",NA
"Statt diesen Rechtsbruch durch eine Änderung des Betriebsverfassungsgesetzes noch zu legalisieren, fordern BÜNDNIS 90/DIE GRÜNEN vielmehr ein Verbandsklagerecht für Gewerkschaften zur Einhaltung von Tarifverträgen","701",NA
"BÜNDNIS 90/DIE GRÜNEN fordern die ersatzlose Streichung des § 116 AFG, der die Streikmöglichkeiten der Gewerkschaften drastisch einschränkt","701",NA
"Unser Ziel ist es, in den Aufsichtsräten großer Kapitalgesellschaften VertreterInnen von Verbraucher- und Umweltverbänden Sitze einzuräumen","403",NA
"Die Tarifautonomie ist ein wichtiges Element demokratischer Mitgestaltung","202",NA
"BÜNDNIS 90/DIE GRÜNEN unterstützen die Bemühungen, den Flächentarifvertrag als wesentliches Element einer solidarischen Lohnpolitik zu erhalten und zukunftssicher auszugestalten","701",NA
"Der Aufbau selbstverwalteter und genossenschaftlicher Unternehmen muß begünstigt und eine geeignete Rechtsform geschaffen werden","401",NA
"Existenzgründungen fördern",NA,NA
"Kleine und mittlere Unternehmen stärken",NA,NA
"BÜNDNIS 90/DIE GRÜNEN wollen die Förderung von kleinen und mittleren Unternehmen sowie von Existenzgründungen umfassend reformieren","403",NA
"Dabei wollen wir die Wettbewerbsnachteile dieser Betriebsgrößen ausgleichen","403",NA
"und eine verbesserte Qualifikationsförderung durchsetzen","402",NA
"Der Ausgleich von Nachteilen für ExistenzgründerInnen, kleine und mittlere Unternehmen soll unter anderem mit öffentlichen Förderprogrammen erfolgen","402",NA
"Statt neuer Förderprogramme für den Mittelstand und ExistenzgründerInnen wollen BÜNDNIS 90/DIE GRÜNEN die fast 400 Förderprogramme neu ordnen, in einige wenige Grundprogramme überführen","303",NA
"Die Programme sollen sich konzentrieren auf Produkt- und Prozeßinnovationen, Markteinführung, Qualifikation, Beratung und Bürgschaften","303",NA
"Die Stärkung der Eigenkapitalbasis der kleinen und mittleren Unternehmen soll durch den Aufbau eines funktionsfähigen Risikokapitalmarktes als Alternative zum Bankensystem erfolgen","403",NA
"Eine überregionale Informationsbörse, an der potentielle Risikokapitalgeber und Beteiligungsnehmer zusammengeführt werden, ist ein erster Schritt","403",NA
"Mittel- bis langfristig soll die Beteiligungsfinanzierung die Kreditverbilligung ablösen","403",NA
"Besondere Zielgruppe grüner Existenzgründungspolitik sind Frauen, die sich beruflich eine selbständige Existenz aufbauen wollen","503",NA
"Frauen verfügen häufig über weniger Eigenkapital und weniger Erfahrung in Führungspositionen","503",NA
"Während einem Existenzgründer oft eine Frau den Rücken stärkt, leisten viele Frauen neben ihrer Selbständigkeit zusätzlich Haus- und Familienarbeit","503",NA
"Existenzgründungsförderung muß diese spezifische Situation von Frauen berücksichtigen","503",NA
"Insbesondere sollen die Förderprogramme auch Gründungen mit niedrigen Investitionsvolumen im sozialen und im Dienstleistungsbereich möglich machen","402",NA
"Für ExistenzgründerInnen dürfen keine neuen Hürden aufgebaut werden","402",NA
"So darf die Meisterpflicht nicht ausgedehnt werden","402",NA
"Die Handwerksordnung muß reformiert werden","303",NA
"Es muß grundsätzlich möglich sein, den Meisterbrief auch nach der Existenzgründung berufsbegleitend zu absolvieren","411",NA
"Die Zulassungsvoraussetzung zur Meisterprüfung muß erweitert werden und auch QuereinsteigerInnen aus anderen Berufen ermöglicht werden","411",NA
"Außerdem müssen die Inhalte der Meisterprüfung den gewandelten Anforderungen an einen hochqualifizierten, dienstleistungsorientierten Handwerksbetrieb angepaßt werden","411",NA
"Regionale Potentiale entwickeln",NA,NA
"Die Wirtschaftspolitik der Bundesregierung ist einseitig auf Exportförderung ausgerichtet","408",NA
"So wichtig Exporte für ein hochindustrialisiertes Land wie die Bundesrepublik sind - es darf nicht vergessen werden, daß rund zwei Drittel des Sozialproduktes im Inland abgesetzt werden","408",NA
"Vergessen wird auch, daß Ferntransporte mit Einbußen an Qualität (z|B| Frischeverlust bei Lebensmitteln) und Umweltverträglichkeit (durch Straßenferntransport) einhergehen","416",NA
"BÜNDNIS 90/DIE GRÜNEN wollen die Stärken und Fähigkeiten von Regionen stärker ins Blickfeld rücken","408",NA
"Dazu gehören in besonderem Maße die Landwirtschaft und das lokale Handwerk, das eine wachsende beschäftigungspolitische Rolle in Deutschland spielt","703",NA
"Die Direktvermarktung ökologisch erzeugter Produkte,","416",NA
"die Förderung der regionalen Vernetzung von Tourismus, Handwerk, Landwirtschaft und Dienstleistungen können die Wirtschaftskraft strukturschwacher Regionen stärken","408",NA
"Wir setzen uns für die Stärkung regionaler Wirtschaftskreisläufe ein","408",NA
"Zu einer stabilen regionalen Wirtschaftsstruktur tragen auch regionalisierte Finanzströme bei","408",NA
"Insbesondere die Sparkassen mit ihrer Ausrichtung auf die Förderung der regionalen Wirtschaft und ihrer Verpflichtung gegenüber dem Gemeinwohl können interessante Partner eines sozial-ökologischen Umbaus sein","414",NA
"Daher wollen wir den Bestand und die Entwicklung dieses Sektors sichern","414",NA
"Die alleinige Orientierung der Regionalförderpolitik am Kriterium Export wollen wir aufgeben","408",NA
"Die Regionen selbst sollen in regionalen, demokratisch legitimierten Entwicklungskonzepten die Leitbilder für eine wünschenswerte Wirtschaftsstruktur formulieren, die Grundlage der Mittelvergabe werden","408",NA
"Sowohl in der Analyse als auch in den Leitbildern und bei den Projekten der regionalen Entwicklungskonzepte sind Fraueninteressen gleichberechtigt zu berücksichtigen","503",NA
"Wir wollen so die Förderung stärker auf die Schaffung von Arbeitsplätzen und die Befriedigung von regionalen Bedürfnissen konzentrieren","701",NA
"Aufbau Ost braucht langen Atem –",NA,NA
"den Osten zukunftsfähig machen",NA,NA
"Die Arbeitslosigkeit in Ostdeutschland ist noch immer doppelt so hoch wie im Durchschnitt der Bundesrepublik und die ostdeutsche Wirtschaft von einem selbsttragenden Aufschwung weit entfernt","701",NA
"Die Regierung Kohl hat beim Aufbau Ost auf veraltete Konzepte gesetzt statt auf Zukunftsfähigkeit","411",NA
"Sie hat die einmalige Chance, den Neuaufbau einer ganzen Volkswirtschaft mit der Weichenstellung auf nachhaltiges Wirtschaften zu verbinden, sträflich vertan","416",NA
"Umsteuern in Richtung Zukunft -",NA,NA
"Aufbaulasten gerecht verteilen",NA,NA
"In der Förderung der Infrastrukturen ist ein Umsteuern insbesondere im Verkehrsbereich notwendig","411",NA
"Während zur Zeit mit riesigem Aufwand Autobahntrassen durchs Land geschlagen werden, Hunderte Millionen in die technische Aufrüstung minimal genutzter Flughäfen wandern und Milliarden für eine überflüssige Transrapid-Strecke verplant werden, wird der sinnvolle Ausbau von Bahnstrecken gestreckt oder ganz unterlassen, die Bahn in der Fläche abgebaut und der Öffentliche Personennahverkehr an der kurzen Leine gehalten","411",NA
"BÜNDNIS 90/DIE GRÜNEN wollen im Verkehrsbereich leistungsfähige Fernverbindungen schaffen (z|B| Lübeck-Stralsund, mitteldeutsche Bahn), die Flächenbahn erhalten und durch Lückenschlüsse vervollständigen sowie","411",NA
"den ÖPNV durch die Förderung der Modernisierung und Verdichtung zu einer tatsächlichen Alternative für den motorisierten Individualverkehr ausbauen","411",NA
"Weiterhin müssen Mittel für die ökologische Sanierung gewerblicher und militärischer Altlasten zur Verfügung gestellt werden","411",NA
"Durch Fördergebietsdarlehen und ein verstärktes Engagement des Bundes für die Städtebauförderung wollen BÜNDNIS 90/DIE GRÜNEN die notwendigen Voraussetzungen für eine behutsame, kostenbewußte und umweltgerechte Sanierung der Innenstädte schaffen","411",NA
"Vor dem Hintergrund dieser großen Aufgaben und der geteilten wirtschaftlichen Entwicklung in Ost und West ist die Senkung des Solidaritätszuschlags - des einzigen Beitrages, den auch Beamte und Selbständige leisten - unsoziale Klientelpolitik","503",NA
"BÜNDNIS 90/DIE GRÜNEN schlagen ein ökologisches Strukturförderprogramm Ost als Gemeinschaftsaufgabe von Bund, Ländern und Gemeinden vor","411",NA
"Die Finanzierung dieses Programms darf nicht zu Lasten der ArbeitnehmerInnen gehen","701",NA
"Deshalb wollen wir - zeitlich befristet - eine Abgabe auf Vermögen über zwei Millionen DM von bis zu 2,5%","701",NA
"Partnerschaftliche Beziehungen",NA,NA
"zu Mittel- und Osteuropa aufbauen",NA,NA
