"text","cmp_code","eu_code"
"Für Ausbau und Entwicklung der Demokratie ist unverzichtbar, daß jeder und jede frei und ungehindert ihre Meinung öffentlich äußern und verbreiten, demonstrieren und protestieren kann","202",NA
"Das Demonstrationsrecht ist daher wiederherzustellen","202",NA
"Demokratie braucht ein Klima der Toleranz und die Achtung der Bürgerrechte aller","202",NA
"Allerdings haben Meinungskundgabe und Demonstrationsfreiheit da ihre Grenze, wo Menschen das Existenzrecht oder die Menschenwürde abgesprochen werden","201",NA
"Das Vermummungsverbot und das Verbot, Schutzkleidung zu tragen, sind aufzuheben","202",NA
"und Aktionen des gewaltfreien Widerstandes wie Sitzblockaden zu entkriminalisieren","202",NA
"Ein allgemeines Akteneinsichtsrecht in nicht personenbezogene Dateien der öffentlichen Hand soll die Kontrolle von Regierung und Verwaltung stärken","202",NA
"So lassen sich auch leichter Korruption und Mauscheleien bekämpfen","304",NA
"Jede/r muß auch grundsätzlich das Recht haben, Einsicht in Unterlagen zu nehmen, die Behörden zur eigenen Person anfertigen","201",NA
"Zugleich muß der Schutz der persönlichen Daten der BürgerInnen durch ein neues Datenschutzgesetz verbessert werden","201",NA
"In der Privatwirtschaft sind gleichhohe Standards zu schaffen wie in der öffentlichen Verwaltung","403",NA
"Es ist nicht zu akzeptieren, daß ein blühender Handel mit den privaten Daten der Bevölkerung betrieben wird","403",NA
"Wir setzen uns für eine bürgernahe Gestaltung des Petitionsrechts als demokratischem Mitwirkungs- und Beschwerderecht ein und wollen daher die Stärkung der Beschwerde- und Petitionsausschüsse in Bund und Ländern erreichen","202",NA
"Ein Verbandsklagerecht soll eine Klagemöglichkeit gegenüber Großprojekten einräumen, wo allgemeine Interessen vorliegen und die Kräfte einzelner BürgerInnen nicht hinreichen","202",NA
"Kinder und Jugendliche sollen an Entscheidungen, die sie selbst betreffen, verbindlich beteiligt werden","706",NA
"Wir wollen die Absenkung des Wahlalters und des Beteiligungsrechtes an Volksentscheiden auf das 16","202",NA
"Lebensjahr erreichen",NA,NA
"Durch die Einführung von Volksinitiativen, Volksbegehren und Volksentscheid soll der Auftrag des Grundgesetzes endlich eingelöst werden, wonach die Staatsgewalt vom Volke ”in Wahlen und Abstimmungen” ausgeübt wird","202",NA
"Sie sind eine Chance für mehr aktive politische Beteiligung der BürgerInnen","202",NA
"Auch über Verfassungsänderungen und internationale Verträge, die nationale Souveränitätsrechte auf internationale Organisationen übertragen, soll das Volk abschließend entscheiden können","202",NA
"Volksbegehren und Volksentscheid dürfen indes den Grundrechts- und Minderheitenschutz der Verfassung nicht gefährden","201",NA
"Dafür sind geeignete Verfahrenssicherungen zu schaffen","201",NA
"Mehr Demokratie und demokratische Kontrolle fordern wir gerade auch für die Europäische Union","110",NA
"Es darf keine Ausweitung der Kompetenzen europäischer Einrichtungen geben, ohne daß gleichzeitig die Befugnisse zur Kontrolle durch das Europäische Parlament und den Europäischen Gerichtshof entscheidend erweitert werden","110",NA
"Mehr Bürgernähe und Transparenz der Verwaltung",NA,NA
"Die notwendige Modernisierung des Staates ist nicht denkbar ohne engagierte, ziel- und ergebnisorientiert handelnde Verwaltung","303",NA
"Das Leitbild der Verwaltung muß sich an der Dienstleistung für BürgerInneninteressen orientieren","303",NA
"Der Abbau umständlicher Bürokratie reduziert die großen finanziellen Belastungen der öffentlichen Haushalte","303",NA
"Wir wollen Anreize zum Sparen bieten und Mittelverschwendung verhindern","303",NA
"Möglich wird dies durch Standards der Effizienz, Leistungsanreize für die Beschäftigten, dezentrale Organisation und vorausschauende Darstellung der Kosten sowie durch Zeit- und Qualitätsmanagement","303",NA
"Transparenz und Aktenöffentlichkeit, Aufgabenrotation und intelligente Binnenkontrollen sollen die Korruption minimieren","304",NA
"Die ”hergebrachten Grundsätze des Berufsbeamtentums” sollen aus dem Grundgesetz gestrichen werden","303",NA
"LehrerInnen und HochschulprofessorInnen zum Beispiel müssen keine BeamtInnen sein","303",NA
"Die Verbeamtung im Öffentlichen Dienst wird künftig zur Ausnahme, das Angestelltenverhältnis zum Regelfall","303",NA
"Nur einzelne hoheitliche Aufgaben – bestimmte Bereiche der Polizei, Rechtspflege und Finanzverwaltung – sollen BeamtInnen übertragen werden","303",NA
"Moderne Personalpolitik mit mehr Eigenverantwortung der Beschäftigten und leistungsgerechten Aufstiegschancen muß preußisches Vorschriften- und Obrigkeitsdenken sowie starre Hierarchien ersetzen","303",NA
"Führungspositionen sollen nur noch auf Zeit vergeben werden","303",NA
"Die Verwaltungsreform muß zur Frauenförderung genutzt werden","503",NA
"Dazu gehören nicht nur Gleichstellung und Quotierung","503",NA
"Wir wollen qualifizierte Mischarbeitsplätze, Modelle für flexible Wochenarbeitszeiten, Arbeitszeitkonten, ”Sabbatjahre”, Altersteilzeit und verbesserte Möglichkeiten für den Berufsaus- und Wiedereinstieg einführen","503",NA
"Wir wollen eine konsequent funktions- und leistungsgerechte Bezahlung von BeamtInnen und Angestellten","303",NA
"Die Dienstaltersstufen, nach denen die Gehälter bislang mit höherem Alter steigen, entfallen","303",NA
"Verantwortung für die deutsche Geschichte",NA,NA
"Wir stellen uns der Verantwortung für die deutsche Geschichte","602",NA
"Wir setzen uns für die volle Anerkennung, rechtliche Rehabilitierung und Entschädigung aller Opfer des Nationalsozialismus ein","602",NA
"Wir wollen ein umfassendes Rehabilitierungsgesetz und die Errichtung einer Bundesstiftung, die Opfern Rentenzahlungen ermöglicht","602",NA
"Der weitgehende Ausschluß der Opfer des Nationalsozialismus in Osteuropa vom Erhalt der Entschädigungsrenten ist für uns inakzeptabel","606",NA
"Erinnerungs- und Dokumentationsarbeit ist auch für die vergessenen Opfergruppen einzuleiten","602",NA
"Das Bundesarchivgesetz darf nicht weiterhin die geschichtliche Aufarbeitung behindern","602",NA
"Wenngleich das Unrecht der DDR nicht vergleichbar ist mit den Greueln des Nationalsozialismus, gilt auch hier: für die Aufarbeitung von Unrecht kann es keinen Schlußstrich geben","602",NA
"Unser Umgang mit den Opfern ist Maßstab dafür, wie wir das DDR-Unrecht bewerten","602",NA
"Die Rehabilitierungs- und Entschädigungsgesetze für DDR-Unrecht müssen zu verbesserten Leistungen gerade im Lebensalter führen","504",NA
"Soweit dies mit rechtsstaatlichen Mitteln noch möglich ist, müssen die TäterInnen strafrechtlich zur Verantwortung gezogen werden","605",NA
"Zur Rechtssicherheit und materiellen Gerechtigkeit in den neuen Bundesländern gehört auch, daß Menschen, die zu DDR-Zeiten Haus oder Grundstück redlich erworben haben, der Besitz erhalten bleibt","706",NA
"Nachfolgeregelungen zum Einigungsvertrag, die das Prinzip Rückgabe vor Entschädigung verstärken, sind, soweit rechtlich möglich, zu korrigieren","706",NA
"Die Ergebnisse der Bodenreform aus der Zeit von 1945-1949 dürfen nicht in Frage gestellt werden","706",NA
"Pachtzins für Erholungsgrundstücke (”Datschen”) muß für die Bevölkerung bezahlbar bleiben","706",NA
"Medienvielfalt, Pressefreiheit und kulturelle Vielfalt sichern",NA,NA
"Medien- und Kulturpolitik ist in Deutschland vor allem Ländersache","301",NA
"Wir setzen uns für publizistische Vielfalt und die Entwicklung einer offenen und demokratischen Medien- und Kommunikationsstruktur ein","502",NA
"Dazu gehören der öffentlich-rechtliche und der nichtkommerzielle Rundfunk als Gegengewichte zum privatrechtlich-kommerziellen Rundfunk","502",NA
"Wir wollen den föderalen Gebührenfinanzausgleich für die ARD erhalten","502",NA
"Das digitale Fernsehen kann nicht nur aus Pay-TV bestehen","502",NA
"Der Zugang für Anbieter, die kein Pay-TV veranstalten, muß vorgeschrieben und ordnungspolitisch Vielfalt garantiert werden","502",NA
"Großereignisse, etwa Sportwettkämpfe, dürfen nicht für zahlungskräftige Kunden des Pay-TV reserviert werden","502",NA
"Internet und Mailboxen bieten neue Möglichkeiten einer offenen, vielfältigen und demokratischen Kommunikation","202",NA
"Wir lehnen daher Zensurmaßnahmen ab","201",NA
"Für die notwendige Verfolgung von Kinderpornographie und anderer strafbarer Inhalte bedarf es keiner neuen Gesetze, sondern der besseren technischen Ausstattung von Strafverfolgungsbehörden","303",NA
"NutzerInnen hinterlassen Datenspuren in elektronischen Netzen","201",NA
"Hier werden sensible personenbezogene Daten transportiert","201",NA
"Wir wollen daher verbesserte Regelungen zum Daten- und VerbraucherInnenschutz","201",NA
"Die Presse übt eine wichtige Kontrollfunktion in der Demokratie aus","202",NA
"Durch ein umfassendes Zeugnisverweigerungsrecht ist der Schutz der Pressefreiheit vor Zugriffen der Polizei und Staatsanwaltschaft zu verbessern","202",NA
"Die Medienkonzentration führt zu einer immer stärkeren Vereinheitlichung der Medienlandschaft","502",NA
"Daher ist der Ausbau der inneren Pressefreiheit um so notwendiger","202",NA
"Dazu müssen im Presserechtsrahmengesetz die redaktionelle Freiheit und die Mitbestimmung der JournalistInnen gestärkt werden","202",NA
"Kulturelle Vielfalt und künstlerische Freiheit stellen zentrale Existenzbedingungen einer demokratischen Gesellschaft dar","502",NA
"Der Bund hat die Existenz der von ihm mitgetragenen Kultureinrichtungen, länderübergreifenden Förderungen und kulturellen Modellprojekte nach neuen Kriterien zu sichern","502",NA
"Wir wollen den Ausbau der Regelungen zur sozialen Sicherung der KünstlerInnen erreichen","504",NA
"und die Bundesfilmförderung durch eine Pflichtabgabe aller von ihr profitierenden Filmbranchen beibehalten","502",NA
"Die vom Bund verantwortete auswärtige Kulturpolitik ist an Kriterien zu binden, die die Verständigung und demokratische Entwicklung der Völker erleichtern","202",NA
"und die dazu beitragen, Vorurteile und Fremdenfeindlichkeit abzubauen","606",NA
"Verhältnis von Staat und Kirche neu bestimmen",NA,NA
"BÜNDNIS 90/DIE GRÜNEN verteidigen die Freiheit der religiösen und weltanschaulichen Betätigung","201",NA
"sowie die weltanschauliche Neutralität des Staates","602",NA
"In einer säkularen und pluralen Gesellschaft müssen Kirche und Staat getrennt sein","602",NA
"Die Kirchen und viele christliche Basisinitiativen sind für uns vielfach wertvolle Verbündete z.B. im Kampf gegen die Ellenbogengesellschaft und für eine humane AusländerInnen- und Sozialpolitik","606",NA
"Wir wollen in einem gründlichen Diskussionsprozeß mit Kirchen, Religions- und Weltanschauungsgemeinschaften und der Gesellschaft neue Formen der Finanzierung der Arbeit im gesellschaftspolitischen Bereich erarbeiten","606",NA
"Die bislang durch den Staat eingezogene Kirchensteuer soll mittelfristig durch Mitgliedsbeiträge, die von den Kirchen selbst erhoben werden, abgelöst werden","602",NA
"Wir wollen - unabhängig vom konfessionellen Religionsunterricht - integratives und multikulturelles Lernen im Bereich Lebenspraxis, Ethik und Religionskunde fördern","606",NA
"Die bislang staatlich organisierte Militärseelsorge gehört in die Eigenverantwortung und Trägerschaft der Kirchen","602",NA
"Das allgemeine Arbeits-, Sozial- und Tarifrecht muß auch für kirchliche MitarbeiterInnen gelten","602",NA
"Rechte von Minderheiten stärken",NA,NA
"Schutz von Flüchtlingen als oberstes Prinzip der Asylpolitik",NA,NA
"Das Asylrecht ist ein unveräußerlicher Teil der Menschenrechte und Ausdruck unserer historischen Verantwortung","201",NA
"Unser Ziel bleibt darum eine Mehrheit für die Wiederherstellung des Grundrechts auf Asyl","201",NA
"Nach dem neuen Recht kann niemand anerkannt werden, der über ein Nachbarland in die Bundesrepublik kommt","201",NA
"Der Umgang mit Flüchtlingen ist auch ein Gradmesser für den demokratischen Rechtsstaat","202",NA
"Zusammen mit Flüchtlings-, Menschen- und Bürgerrechtsorganisationen sowie den Engagierten aus der Kirchenasylbewegung setzen sich Bündnis 90/Die Grünen gegen die gesellschaftliche Ausgrenzung und Illegalisierung sowie für einen effektiven Schutz von Flüchtlingen ein","201",NA
"Das Bundesverfassungsgericht hat die faktische Abschaffung des Asylrechts in allen wesentlichen Punkten bestätigt","201",NA
"Es hat jedoch lediglich entschieden, was verfassungsrechtlich zulässig, nicht, was rechtlich möglich und menschlich nötig ist","606",NA
"Wir brauchen darum eine Gesetzgebung, die rechtliche Spielräume ausschöpft und sicherstellt, daß Menschen geschützt werden, die vor Folter, Tod, Krieg, Bürgerkrieg oder grausamer Behandlung fliehen","606",NA
"Die Genfer Flüchtlingskonvention muß - nach den Vorgaben des Hohen Flüchtlingskommissars - in Deutschland in vollem Umfang angewandt werden, ebenso die Europäische Menschenrechtskonvention","201",NA
"Wir lehnen das geltende Asylrecht ab, das vor allem nach dem Fluchtweg, nicht aber nach den Fluchtgründen fragt und denjenigen den Anspruch auf Asyl verwehrt, die über einen angeblich sicheren Drittstaat eingereist sind","606",NA
"Die Frage, wer als Flüchtling anerkannt wird, darf nicht gegen internationale Flüchtlingsabkommen verstoßen und muß dem individuellen Recht auf Asyl Rechnung tragen","201",NA
"Zumindest muß in einem förmlichen Einzelverfahren sichergestellt werden, ob im Drittstaat tatsächlich Schutz gewährt wird","606",NA
"Rückübernahmeabkommen mit Verfolgerstaaten – z.B.Algerien - müssen aufgekündigt werden","606",NA
"Sonderverfahren wie bei der Einreise an Flughäfen, in denen die einreisenden Flüchtlinge ihre Rechte faktisch nicht geltend machen können, wollen wir ersatzlos streichen","201",NA
"Wir brauchen daher eine grundlegende Reform des Asylverfahrensgesetzes","303",NA
"Asylpolitik steht auch in der Verantwortung der Europäischen Union","201",NA
"Eine europäische Regelung darf aber nicht zum Abbau von Rechten führen","201",NA
"Die Bundesrepublik muß dort für hohe rechtsstaatliche Standards bei den Asylverfahren und einen umfassenden Asylbegriff sorgen","201",NA
"Die Abschottung der europäischen Grenzen und das elektronische Fingerabdrucksystem ”Eurodac”, mit dem AsylbewerberInnen und sogenannte illegal Einreisende erfaßt werden, lehnen wir ab","110",NA
"Für Massenfluchtsituationen brauchen wir europäische Regelungen, die eine rasche, unbürokratische Aufnahme und einen sicheren Aufenthalt garantieren; alle Mitgliedstaaten müssen Verantwortung übernehmen","201",NA
"Kriegs- und Bürgerkriegsflüchtlinge, Kriegsdienstverweigerer und Deserteure sowie Opfer nicht-staatlicher Verfolgung müssen asylrechtlichen Schutz erhalten","201",NA
"Folter, geschlechtsspezifische Verfolgung von Frauen oder Verfolgung aufgrund der sexuellen Identität (Homosexualität, Transsexualität) sind Asylgründe und müssen endlich als politische Verfolgung anerkannt werden","201",NA
"Das Kindeswohl muß auch im Ausländerrecht Vorrang haben","201",NA
"Vorbehalte gegen die UN-Kinderrechtskonvention müssen zurückgenommen werden","201",NA
"Im Ausländergesetz sollte geregelt werden, daß die Bundesländer für gefährdete Gruppen und die Kommunen für humanitäre Einzelfälle eigenständig ein dauerhaftes Bleiberecht erteilen können","201",NA
"Die Möglichkeit, einen Abschiebestopp nach § 54 Ausländergesetz zu erlassen, muß voll ausgeschöpft werden","201",NA
"Bündnis 90/Die Grünen lehnen die Sonderbehandlung und Ausgrenzung von Flüchtlingen und Asylsuchenden ab und setzen sich für eine soziale und rechtliche Gleichstellung ein","705",NA
"Das ”Asylbewerberleistungsgesetz” mit seinen diskriminierenden Regelungen wollen wir streichen","705",NA
"Die Pläne, de facto-Flüchtlingen sämtliche soziale Leistungen zu streichen, lehnen wir strikt ab","504",NA
"Und wir wenden uns gegen Bestrebungen, Flüchtlinge mit einer Asylcard weiter zu diskriminieren","705",NA
"Menschenwürdige Mindeststandards, wie Zugang zu Gesundheitsversorgung, Schule und Ausbildung, müssen allen Menschen gewährt werden, unabhängig von ihrem Aufenthaltsrecht","504",NA
"Abschiebungshaft verstößt gegen rechtsstaatliche Prinzipien","202",NA
"Wir lehnen sie darum ab","202",NA
"Statt den Herkunftstaaten von Flüchtlingen mit dem Entzug der Entwicklungshilfe zu drohen, wollen wir eine entwicklungspolitische Zusammenarbeit, die dazu beiträgt, die Fluchtursachen zu verringern","107",NA
"Mit der Bekämpfung der Fluchtursachen müssen wir zu Hause anfangen","105",NA
"Ein erster Schritt in diese Richtung ist die Unterbindung von Waffenexporten in Staaten, die die Menschenrechte verletzen","105",NA
"Migration: Bürgerrechte und Integration",NA,NA
"Von den mehr als 7 Millionen Nichtdeutschen im Land leben weit mehr als die Hälfte bereits länger als 10 Jahre hier, ein Viertel bereits über 20 Jahre","705",NA
"Die Mehrzahl ihrer Kinder ist hier geboren","705",NA
"Wir wollen nicht mehr, daß das AusländerInnenrecht diesen MigrantInnen die wichtigsten Rechte verwehrt und sie als ”Fremde” und ”Gäste” behandelt","705",NA
"Für sie ist Deutschland zur Heimat geworden","705",NA
"Sie müssen einen gesicherten Aufenthaltsstatus erhalten und dürfen nicht mehr ausgewiesen werden","705",NA
"Wir unterstützen die ImmigrantInnen in ihrer Forderung nach vollen Bürgerrechten","201",NA
"Das deutsche Staatsbürgerschaftsrecht von 1913 ist in europäischem Maßstab Schlußlicht","201",NA
"Es fußt immer noch überwiegend auf dem Bluts- und Abstammungsprinzip","201",NA
"Wo selbst die Tatsache jahrzehntelanger Einwanderung geleugnet wird, kann zukünftige Einwanderung nicht human gestaltet werden","705",NA
"Verweigerte Integration von AusländerInnen und AussiedlerInnen schafft aber gravierende soziale Probleme","705",NA
"Wir wollen diesem Demokratiedefizit und der Fremdenfeindlichkeit ein Programm der Integration entgegenstellen und die Emanzipation der MigrantInnen fördern","705",NA
"Erleichterte Einbürgerung dient der Integration","705",NA
"Mit einem Niederlassungsgesetz die Rechtlosigkeit überwinden",NA,NA
"Mit der Unionsbürgerschaft haben MigrantInnen aus EU-Ländern umfassendere Rechte als andere MigrantInnen","705",NA
"BÜNDNIS 90/DIE GRÜNEN wollen mit einem Niederlassungsgesetz eine weitestgehende rechtliche Gleichstellung von BürgerInnen aus Drittstaaten mit BürgerInnen der Europäischen Union erreichen","705",NA
"Das Niederlassungsgesetz soll anstelle des restriktiven Ausländerrechts für alle gelten, die seit mindestens drei Jahren rechtmäßig in Deutschland leben","705",NA
"Es umfaßt Rechte der politischen Betätigung, der demokratischen Teilhabe und des sozialen Schutzes","705",NA
"Es ermöglicht auch eine Planungssicherheit für diejenigen, die noch keinen Anspruch auf den deutschen Paß erworben haben","705",NA
"Auch für Angehörige aus Drittstaaten muß das für EU-BürgerInnen geltende Kommunalwahlrecht eingeführt werden","202",NA
"Unverzichtbar ist gerade wegen der Gewalt gegenüber Frauen ein eigenständiges Aufenthaltsrecht ausländischer EhepartnerInnen unabhängig von der Ehedauer","503",NA
"Mit einem neuen Staatsbürgerschaftsrecht",NA,NA
"Ungerechtigkeit beenden",NA,NA
"Ein neues Staatsbürgerschaftsrecht soll allen in Deutschland geborenen Kindern den deutschen Paß geben, wenn mindestens ein Elternteil hier seinen dauerhaften Lebensmittelpunkt hat","705",NA
"Sie sind InländerInnen und dürfen nicht länger als AusländerInnen behandelt werden","705",NA
"Das Staatsbürgerschaftsrecht muß so geändert werden, daß das Bodenprinzip gleichberechtigt neben das Abstammungsprinzip tritt","705",NA
"Nach fünf Jahren müssen hier lebende AusländerInnen das Recht zur Einbürgerung erhalten","705",NA
"Die Ermessenseinbürgerung muß bereits vorher möglich sein","705",NA
"Beide Instrumente sind von bürokratischen Schikanen zu entrümpeln","705",NA
"Die Anerkennung der doppelten Staatsbürgerschaft ist längst überfällig - nicht nur für diejenigen, denen die notwendige Ausbürgerung von Seiten ihrer Herkunftstaaten verweigert wird","705",NA
"Mit einem transparenten",NA,NA
"Verfahren Einwanderung human gestalten",NA,NA
"Deutschland ist schon lange ein Einwanderungsland","607",NA
"Wir wollen mit transparenten Verfahren zukünftige Einwanderung regeln","705",NA
"Dies wird auch Ängste in der Bevölkerung gegenüber weiterer Zuwanderung reduzieren","607",NA
"Ein Einwanderungsgesetz versetzt das Land in die Lage, auf Einwanderungsprozesse sozial, human und demokratisch zu reagieren","607",NA
"Es soll zum einen sicherstellen, daß ArbeitsmigrantInnen nach Deutschland kommen können, wenn für sie ein Arbeitsplatz zur Verfügung steht","607",NA
"Zum anderen sollen mindestens ein Viertel aller Einwanderungsbewilligungen aus humanitären Gründen ausgesprochen werden, denn wir wollen kein reines Arbeitsaufnahmegesetz","705",NA
"Dies muß mit Maßnahmen zur Integration, etwa Sprachkursen, verbunden werden","705",NA
"Das Recht auf Familiennachzug muß erhalten, die Gleichberechtigung von Lebenspartnerschaften, denen die Eheschließung aus Rechtsgründen verwehrt ist, sichergestellt werden","705",NA
"Nach einer Übergangsfrist sollen SpätaussiedlerInnen allen anderen Einwanderungswilligen rechtlich gleichgestellt werden","705",NA
"Toleranz ist nicht zu verwechseln mit Gleichgültigkeit","607",NA
"Eine funktionsfähige multikulturelle Gesellschaft muß auch konfliktfähig sein","607",NA
"Das Ausländerrecht darf kein Strafrecht sein","705",NA
"Wir lehnen die Praxis der Ausweisung als zusätzliche De-facto-Strafe ab","705",NA
"Es ist ein besonderer Skandal, wenn hier geborene und aufgewachsene Jugendliche abgeschoben werden","705",NA
"Ohne gleichberechtigten Einbezug der in Deutschland lebenden MigrantInnen in die Lösung von Konflikten, ohne Öffnung aller Berufe für diese Menschen und ohne Förderung der bürgerrechtlichen und integrativen Arbeit der Verbände von MigrantInnen sind multikulturelle Konflikte nicht lösbar und Integration unmöglich","607",NA
"Für ein Antidiskriminierungsgesetz",NA,NA
"Am Umgang mit Minderheiten zeigt sich der demokratische Konsens einer Gesellschaft","705",NA
"Zwischen dem Benachteiligungsverbot in der Verfassung und dessen Umsetzung im täglichen Leben klafft häufig eine breite Lücke","705",NA
"Viele europäische Länder haben Antidiskriminierungsgesetze erlassen","705",NA
"Die Regierung Kohl hat dies bislang verweigert","705",NA
"Wir wollen mit einem Antidiskriminierungsgesetz (ADG) benachteiligten Minderheiten wirksame Mittel in die Hand geben, sich gegen Anfeindungen und Diskriminierungen zu wehren","705",NA
"Wer aufgrund seiner oder ihrer ethnischen Abstammung, Herkunft oder Zugehörigkeit, Hautfarbe, Nationalität, religiösen Anschauung, sexuellen Identität oder Behinderung benachteiligt wird, soll künftig einen Anspruch auf Schadensersatz und Schmerzensgeld haben","705",NA
"Ebenso müssen Maßnahmen gegen die Diskriminierung alter Menschen ergriffen werden","706",NA
"Sowohl die Betroffenen selbst als auch Verbände von Betroffenen sollen, z.B. gegenüber diskriminierenden ArbeitergeberInnen oder VermieterInnen, Ansprüche auf Beseitigung und Unterlassung durchsetzen können","705",NA
"Zur Beseitigung bestehender gesetzlicher Ungleichbehandlungen und Barrieren sind spezielle Regelungen für behinderte Menschen, Schwule und Lesben sowie MigrantInnen notwendig","705",NA
"Zugleich wollen wir zur Prävention die Anti-Gewaltprogramme für alle Minderheiten ausbauen","705",NA
"Minderheiten werden von vielen Menschen, die unter der verfehlten Wirtschafts- und Sozialpolitik leiden, zu Sündenböcken erklärt","705",NA
"Gegen solche Tendenzen will unser ADG den Bedrohten rechtlichen Schutz verschaffen, um Ausgrenzung und Herabsetzung zurückzudrängen","705",NA
"Gleichberechtigte Teilhabe für Menschen mit Behinderungen",NA,NA
"Wir wenden uns gegen die behindertenfeindlichen Tendenzen in unserer Gesellschaft, in der über die ”Brauchbarkeit” von Menschen oder über ”lebenswertes” und ”lebensunwertes” Leben diskutiert wird und in der trotz der Verfolgung von Behinderten während der NS-Zeit immer wieder Stimmen laut werden, die für die ”Euthanasie” Schwerstbehinderter plädieren","705",NA
"Menschen mit Behinderungen muß durch das ADG endlich eine gleichberechtigte Teilhabe am Leben der Gemeinschaft ermöglicht werden","705",NA
"Beim Zugang zum Öffentlichen Personenverkehr, zur Telekommunikation und im Baurecht müssen die Bedürfnisse Behinderter gesetzlich abgesichert werden","705",NA
"Die Gebärdensprache gehörloser Menschen ist als eigene Sprache anzuerkennen","705",NA
"Neben der Verpflichtung zum schrittweisen Abbau von Verkehrsbarrieren sollen die rechtlichen Möglichkeiten behinderter Menschen und ihrer Organisationen gestärkt werden","705",NA
"Eine Stärkung der Mitwirkungsrechte ändert auch die gesellschaftliche Rolle behinderter Menschen: weg vom Objekt der Fürsorge anderer hin zum Subjekt des eigenen Lebens","705",NA
"Gleiche Rechte für Schwule und Lesben",NA,NA
"Schwule und Lesben nehmen Diskriminierung und Mißachtung längst nicht mehr schweigend hin, sondern streiten engagiert für Gleichberechtigung","705",NA
"Das Europäische Parlament hat auf Initiative der Grünen Mindeststandards für die Bürgerrechte von Lesben und Schwulen empfohlen","705",NA
"Diese Standards wollen wir in der Bundesrepublik umsetzen","705",NA
"Gleichgeschlechtliche Partnerschaften müssen die gleichen Möglichkeiten zur rechtlichen Ausgestaltung ihrer Lebensgemeinschaft erhalten wie heterosexuelle: Eheschließungsrecht und Öffnung aller Regelungen für nichteheliche Lebensgemeinschaften","604",NA
"Wir wollen Schutz vor Benachteiligungen in der Arbeitswelt und im Mietrecht,","705",NA
